[
  {
    "nested_field": {
      "foo": {
        "foo_foo": -634218439,
        "foo_bar": "cdJ0E5iqpO",
        "foo_qux": "6TJZNlXSPbRx6uu"
      },
      "bar": null
    },
    "normal_enum": "Foo",
    "tuple_enum": {
      "Write": "Vjm3X0Sjzw3gGJjh"
    },
    "struct_enum": {
      "Move": {
        "x": 648558168,
        "y": -2037828430
      }
    }
  },
  {
    "nested_field": {
      "foo": {
        "foo_foo": -2082362874,
        "foo_bar": "tuC6llzJxWHIPN",
        "foo_qux": "ZpjYrlS"
      },
      "bar": null
    },
    "normal_enum": "Foo",
    "tuple_enum": {
      "Write": "1Dyv3FhhVZ88TqwLXJS"
    },
    "struct_enum": "Quit"
  },
  {
    "nested_field": {
      "foo": {
        "foo_foo": -274448721,
        "foo_bar": "kVOaV",
        "foo_qux": "gj01iaGdGd"
      },
      "bar": {
        "bar_foo": -1313920213,
        "bar_bar": "w7Gsxdh5tZ",
        "bar_qux": "8ZsDcHYak"
      }
    },
    "normal_enum": "Foo",
    "tuple_enum": {
      "Write": "ExuHyAB"
    },
    "struct_enum": {
      "Write": {
        "text": "qrAfhqBGqpShvHhOZOS"
      }
    }
  },
  {
    "nested_field": {
      "foo": {
        "foo_foo": -2037149197,
        "foo_bar": "AyXiM34q52jeSqB2uU",
        "foo_qux": "2eMb9o675OZ0"
      },
      "bar": null
    },
    "normal_enum": "Bar",
    "tuple_enum": {
      "Write": "Wy9ybHRLHJOP"
    },
    "struct_enum": {
      "Write": {
        "text": "D7i5Da8KmFZxf"
      }
    }
  },
  {
    "nested_field": {
      "foo": {
        "foo_foo": 1114193241,
        "foo_bar": "y7Dpt9MJdxwHuQxsg",
        "foo_qux": "CiFdbyWWNMo9AHY7Rpt"
      },
      "bar": {
        "bar_foo": -1226507856,
        "bar_bar": "0No41",
        "bar_qux": "BNGat"
      }
    },
    "normal_enum": "Foo",
    "tuple_enum": {
      "Move": [
        -1867567150,
        1889510961
      ]
    },
    "struct_enum": {
      "Move": {
        "x": 130836621,
        "y": 1883167946
      }
    }
  },
  {
    "nested_field": {
      "foo": {
        "foo_foo": -524380662,
        "foo_bar": "WSq6duC0t7QFb",
        "foo_qux": "GxPyrO9c80qRGKKov"
      },
      "bar": null
    },
    "normal_enum": "Foo",
    "tuple_enum": {
      "Write": "WdQEN"
    },
    "struct_enum": {
      "Move": {
        "x": -326922897,
        "y": 832997153
      }
    }
  },
  {
    "nested_field": {
      "foo": {
        "foo_foo": 904670458,
        "foo_bar": "4pRoNh",
        "foo_qux": "FOf6RiXuIS5Z"
      },
      "bar": null
    },
    "normal_enum": "Bar",
    "tuple_enum": {
      "Move": [
        1839321579,
        369660068
      ]
    },
    "struct_enum": {
      "Move": {
        "x": -343661462,
        "y": -569194176
      }
    }
  },
  {
    "nested_field": {
      "foo": {
        "foo_foo": 699253590,
        "foo_bar": "m7QUVwbdtmnhrDA",
        "foo_qux": "Rq9QeueI"
      },
      "bar": {
        "bar_foo": 939292071,
        "bar_bar": "UKULpg6dfcaAcjc",
        "bar_qux": "FCvIADv5uKWubDs"
      }
    },
    "normal_enum": "Foo",
    "tuple_enum": {
      "ChangeColor": [
        -1973766,
        -1914239283,
        -242979742
      ]
    },
    "struct_enum": {
      "Write": {
        "text": "nEnhUJdHse2iF7"
      }
    }
  },
  {
    "nested_field": {
      "foo": {
        "foo_foo": 800339100,
        "foo_bar": "j6aYSyO2vFRFK",
        "foo_qux": "NUcEG73Ry"
      },
      "bar": {
        "bar_foo": -183653272,
        "bar_bar": "P7OaVSfITBYg",
        "bar_qux": "ZAGEnrvsG4pj"
      }
    },
    "normal_enum": "Bar",
    "tuple_enum": {
      "ChangeColor": [
        896997478,
        -1645364767,
        1292885913
      ]
    },
    "struct_enum": {
      "Move": {
        "x": 1002134462,
        "y": -1968886633
      }
    }
  },
  {
    "nested_field": {
      "foo": {
        "foo_foo": 1355166525,
        "foo_bar": "NQ2wyX1ZNAtdi7",
        "foo_qux": "HpGkOCcmr"
      },
      "bar": {
        "bar_foo": 2055730104,
        "bar_bar": "Iw2aRM9PYhp0Jbfp",
        "bar_qux": "lXLJgKLyO4C9Hntm4"
      }
    },
    "normal_enum": "Foo",
    "tuple_enum": {
      "Move": [
        -814719016,
        -251037839
      ]
    },
    "struct_enum": "Quit"
  },
  {
    "nested_field": {
      "foo": {
        "foo_foo": 1097808633,
        "foo_bar": "0FPEUzHN0kL",
        "foo_qux": "uvOKeJaszNf8RmY"
      },
      "bar": {
        "bar_foo": -59051488,
        "bar_bar": "gO5ZIlJSua",
        "bar_qux": "6zue8Tiewfi4DPk8h7"
      }
    },
    "normal_enum": "Bar",
    "tuple_enum": {
      "ChangeColor": [
        1033425676,
        -2140889854,
        -286025242
      ]
    },
    "struct_enum": {
      "Move": {
        "x": -1206654939,
        "y": -1476204360
      }
    }
  },
  {
    "nested_field": {
      "foo": {
        "foo_foo": -1848714263,
        "foo_bar": "GUpRLci9sIS3zikV",
        "foo_qux": "8NDrEiE"
      },
      "bar": null
    },
    "normal_enum": "Foo",
    "tuple_enum": {
      "Write": "OOKS2"
    },
    "struct_enum": "Quit"
  },
  {
    "nested_field": {
      "foo": {
        "foo_foo": 1055076903,
        "foo_bar": "24WXPJ5GNmG8Jo0",
        "foo_qux": "cI9Zh9ToI"
      },
      "bar": {
        "bar_foo": 325094564,
        "bar_bar": "uf6BhuBs7f",
        "bar_qux": "lwQM8aDpDbygtf02vLT"
      }
    },
    "normal_enum": "Bar",
    "tuple_enum": {
      "Write": "5J4YVENOyjIysLMrA"
    },
    "struct_enum": "Quit"
  },
  {
    "nested_field": {
      "foo": {
        "foo_foo": 57046813,
        "foo_bar": "CamxpAakn6AUm1AF",
        "foo_qux": "J8pDBErsZ"
      },
      "bar": null
    },
    "normal_enum": "Foo",
    "tuple_enum": {
      "ChangeColor": [
        -1623572895,
        -848002469,
        -2100828889
      ]
    },
    "struct_enum": {
      "Move": {
        "x": -692971046,
        "y": -1104662592
      }
    }
  },
  {
    "nested_field": {
      "foo": {
        "foo_foo": -359448470,
        "foo_bar": "6cHoL",
        "foo_qux": "s6ywVc81Pg"
      },
      "bar": null
    },
    "normal_enum": "Bar",
    "tuple_enum": {
      "ChangeColor": [
        1474828552,
        -1430280099,
        -342597379
      ]
    },
    "struct_enum": {
      "Move": {
        "x": -2143239448,
        "y": 1830349193
      }
    }
  },
  {
    "nested_field": {
      "foo": {
        "foo_foo": 262963832,
        "foo_bar": "p9jQ3",
        "foo_qux": "79BxIzOnWX"
      },
      "bar": null
    },
    "normal_enum": "Foo",
    "tuple_enum": {
      "Move": [
        1668155851,
        -1991104373
      ]
    },
    "struct_enum": "Quit"
  },
  {
    "nested_field": {
      "foo": {
        "foo_foo": -1307782456,
        "foo_bar": "RW4wRgk2IjA3",
        "foo_qux": "04Z2J5"
      },
      "bar": {
        "bar_foo": -1189697745,
        "bar_bar": "rwUZp6N0UE3YbfaXb",
        "bar_qux": "OKGaTqlx0JP"
      }
    },
    "normal_enum": "Bar",
    "tuple_enum": {
      "ChangeColor": [
        -672376172,
        161050688,
        581623393
      ]
    },
    "struct_enum": {
      "Write": {
        "text": "ppOJTqJ6opeFp60kd0w"
      }
    }
  },
  {
    "nested_field": {
      "foo": {
        "foo_foo": -1988691590,
        "foo_bar": "E4I4TX",
        "foo_qux": "NIi2koilizdMpIgT"
      },
      "bar": null
    },
    "normal_enum": "Foo",
    "tuple_enum": {
      "Write": "kHkvpoUbaeW8KF"
    },
    "struct_enum": {
      "Write": {
        "text": "iGi0RV0F2A8RU67wE"
      }
    }
  },
  {
    "nested_field": {
      "foo": {
        "foo_foo": -1954056582,
        "foo_bar": "Qw3f7W",
        "foo_qux": "tFJy4M41C"
      },
      "bar": null
    },
    "normal_enum": "Bar",
    "tuple_enum": {
      "Move": [
        -510880366,
        1352721849
      ]
    },
    "struct_enum": {
      "Move": {
        "x": -1049327514,
        "y": 2051885036
      }
    }
  },
  {
    "nested_field": {
      "foo": {
        "foo_foo": 377249961,
        "foo_bar": "ulyEI8XNo",
        "foo_qux": "uU5jw"
      },
      "bar": null
    },
    "normal_enum": "Foo",
    "tuple_enum": {
      "Write": "vP6EZ9h75cVRb49"
    },
    "struct_enum": {
      "Move": {
        "x": 120565064,
        "y": 702264215
      }
    }
  },
  {
    "nested_field": {
      "foo": {
        "foo_foo": -252183052,
        "foo_bar": "z6fz2Up",
        "foo_qux": "5NOxR"
      },
      "bar": null
    },
    "normal_enum": "Foo",
    "tuple_enum": {
      "ChangeColor": [
        -182395659,
        323718560,
        1908049814
      ]
    },
    "struct_enum": {
      "Write": {
        "text": "9w1Av6B3YgSZOQhjyp"
      }
    }
  },
  {
    "nested_field": {
      "foo": {
        "foo_foo": -488742492,
        "foo_bar": "018Vo5G5zH",
        "foo_qux": "fRA4L9WMmQSs"
      },
      "bar": {
        "bar_foo": -2033523262,
        "bar_bar": "BHHcdOlzmtmf8fypJ",
        "bar_qux": "NYOcCGMG"
      }
    },
    "normal_enum": "Foo",
    "tuple_enum": {
      "ChangeColor": [
        151692705,
        389074270,
        -1058539316
      ]
    },
    "struct_enum": {
      "Write": {
        "text": "fBTItnK5c"
      }
    }
  },
  {
    "nested_field": {
      "foo": {
        "foo_foo": 1096531871,
        "foo_bar": "eFLcjrxYP",
        "foo_qux": "fSMOh9b6CaKpiBcbB"
      },
      "bar": {
        "bar_foo": 298176302,
        "bar_bar": "FHH2iZlaBQF08y",
        "bar_qux": "E3w65wW3D"
      }
    },
    "normal_enum": "Foo",
    "tuple_enum": {
      "ChangeColor": [
        1029967745,
        1553725945,
        -1196631233
      ]
    },
    "struct_enum": {
      "Write": {
        "text": "hrOgtCUtWkzmfD"
      }
    }
  },
  {
    "nested_field": {
      "foo": {
        "foo_foo": 1603909998,
        "foo_bar": "idObY",
        "foo_qux": "piP6zu1fRCfgl6GJCoj"
      },
      "bar": {
        "bar_foo": -1442188210,
        "bar_bar": "vKg5sR7KEnHhe",
        "bar_qux": "EFQl4x2L"
      }
    },
    "normal_enum": "Bar",
    "tuple_enum": {
      "Move": [
        -2073215740,
        -1346206081
      ]
    },